AWK;Wahlkreis;MdA_2025;party_short_name;politician_id;mandate_id;mandate_type;committees;spokesperson_role;constituency_office_address;email_address;sm_facebook;sm_instagram;sm_tiktok;sm_x;sm_bluesky;sm_youtube;sm_twitch;sm_discord;sm_telegram;sm_rss;sm_newsletter;berlin_residence;berlin_list_type;berlin_connection;eu_group
;Landesliste Berlin (EU-Parlament 2024 - 2029);Hildegard Bentele;CDU;117485;62738;list;Ausschuss für Industrie, Forschung und Energie (ITRE) | Ausschuss für Umwelt, Klima und Lebensmittelsicherheit (ENVI) | Entwicklungsausschuss (DEVE);;;;;;;;;;;;;;;true;Landesliste Berlin;"Former MdA; office in Berlin";EPP
;Landesliste Berlin;Gabriele Bischoff;SPD;;;list;;;;;;;;;;;;;;;;true;Landesliste Berlin;"Primary Berlin SPD MEP; office in Mitte";S&D
;Bundesliste;Erik Marquardt;Grüne;;;list;;;;;;;;;;;;;;;;true;Bundesliste;"Berlin-based; lists Berlin address in EU profile";Greens/EFA
;Bundesliste;Hannah Neumann;Grüne;;;list;;;;;;;;;;;;;;;;true;Bundesliste;Political base and office in Berlin;Greens/EFA
;Bundesliste;Sergey Lagodinsky;Grüne;;;list;;;;;;;;;;;;;;;;true;Bundesliste;Berlin lawyer and local party figure;Greens/EFA
;Bundesliste;Sebastian Everding;Tierschutzpartei;;;list;;;;;;;;;;;;;;;;true;Bundesliste;"Party HQ in Berlin; strong local ties";The Left
;Bundesliste;Sibylle Berg;Die PARTEI;;;list;;;;;;;;;;;;;;;;true;Bundesliste;Elected via Die PARTEI (Berlin-centric);NI
;Bundesliste;Mary Khan-Hohloch;AfD;;;list;;;;;;;;;;;;;;;;true;Bundesliste;"Resides in Berlin/Brandenburg area; active in local structures";ESN
