Name;Party;EU_Group;List_Type;Connection
Gabriele Bischoff;SPD;S&D;Landesliste Berlin;"Primary Berlin SPD MEP; office in Mitte"
Hildegard Bentele;CDU;EPP;Landesliste Berlin;"Former MdA; office in Berlin"
Erik Marquardt;GRÜNE;Greens/EFA;Bundesliste;"Berlin-based; lists Berlin address in EU profile"
Hannah Neumann;GRÜNE;Greens/EFA;Bundesliste;"Political base and office in Berlin"
Sergey Lagodinsky;GRÜNE;Greens/EFA;Bundesliste;"Berlin lawyer and local party figure"
Sebastian Everding;Tierschutzpartei;The Left;Bundesliste;"Party HQ in Berlin; strong local ties"
Sibylle Berg;Die PARTEI;NI;Bundesliste;"Elected via Die PARTEI (Berlin-centric)"
Mary Khan-Hohloch;AfD;ESN;Bundesliste;"Resides in Berlin/Brandenburg area; active in local structures"
